{
  "$schema": "https://json-schema.org/draft/2020-12/schema",
  "title": "Harness benchmark case",
  "type": "object",
  "required": [
    "schema_version",
    "id",
    "task",
    "workspace",
    "verification"
  ],
  "properties": {
    "schema_version": {
      "const": 1
    },
    "id": {
      "type": "string",
      "pattern": "^[A-Za-z0-9][A-Za-z0-9._-]{1,63}$"
    },
    "tags": {
      "type": "array",
      "items": {
        "type": "string"
      }
    },
    "task": {
      "type": "object",
      "required": [
        "description"
      ],
      "properties": {
        "description": {
          "type": "string",
          "minLength": 1
        },
        "acceptance_criteria": {
          "type": "array",
          "items": {
            "type": "string"
          }
        },
        "files": {
          "type": "array",
          "items": {
            "type": "string"
          }
        },
        "risk": {
          "enum": [
            "R0",
            "R1",
            "R2",
            "R3"
          ]
        }
      }
    },
    "workspace": {
      "type": "object",
      "required": [
        "source"
      ],
      "properties": {
        "source": {
          "type": "string"
        },
        "harness_overlay": {
          "type": "boolean"
        },
        "setup_commands": {
          "type": "array",
          "items": {
            "type": "array",
            "items": {
              "type": "string"
            },
            "minItems": 1
          }
        }
      }
    },
    "verification": {
      "type": "object",
      "properties": {
        "public_checks": {
          "type": "array",
          "items": {
            "type": "object",
            "required": [
              "name",
              "argv"
            ],
            "properties": {
              "name": {
                "type": "string"
              },
              "kind": {
                "enum": [
                  "acceptance",
                  "regression",
                  "security",
                  "mutation",
                  "quality"
                ]
              },
              "argv": {
                "type": "array",
                "items": {
                  "type": "string"
                },
                "minItems": 1
              },
              "cwd": {
                "type": "string"
              },
              "timeout_seconds": {
                "type": "integer",
                "minimum": 1
              },
              "metric": {
                "type": "object",
                "required": [
                  "name",
                  "regex"
                ],
                "properties": {
                  "name": {
                    "type": "string"
                  },
                  "regex": {
                    "type": "string"
                  },
                  "scale": {
                    "type": "number"
                  }
                }
              }
            }
          }
        },
        "private_oracle": {
          "type": "string"
        }
      }
    }
  }
}
